<?xml version="1.0" encoding="UTF-8" ?>
<!--
  #%L
  ff4j-core
  %%
  Copyright (C) 2013 Ff4J
  %%
  Licensed under the Apache License, Version 2.0 (the "License");
  you may not use this file except in compliance with the License.
  You may obtain a copy of the License at
  
       http://www.apache.org/licenses/LICENSE-2.0
  
  Unless required by applicable law or agreed to in writing, software
  distributed under the License is distributed on an "AS IS" BASIS,
  WITHOUT WARRANTIES OR CONDITIONS OF ANY KIND, either express or implied.
  See the License for the specific language governing permissions and
  limitations under the License.
  #L%
  -->

<features xmlns="http://www.ff4j.org/schema/ff4j" 
     xmlns:xsi="http://www.w3.org/2001/XMLSchema-instance"
	 xsi:schemaLocation="http://www.ff4j.org/schema/ff4j ../../main/resources/ff4j-1.2.0.xsd">

	<!-- No Expression -->
	<feature uid="first" enable="true" description="some desc">
		<flipstrategy class="org.ff4j.strategy.time.OfficeHourStrategy" >
			<param name="monday"    	 value="08:00-12:00,13:30-18:00" />
			<param name="tuesday"   	 value="08:00-12:00,13:30-18:00" />
			<param name="wednesday" 	 value="08:00-12:00,13:30-18:00" />
			<param name="thursday"  	 value="08:00-12:00,13:30-18:00" />
			<param name="friday" 		 value="08:00-12:00,13:30-18:00" />
			<param name="saturday" 		 value="10:00-19:00" 			/>
			<param name="sunday" 		 value="" />
			<param name="publicHolidays" value="2015-01-01,2015-05-01,2015-12-25" />
			<param name="specialOpenings" value="[08:00-12:00]@2015-01-01;[08:00-12:00]@2015-01-02" />
		</flipstrategy>
	</feature>
		
</features>

