<?xml version="1.0" encoding="UTF-8" ?>
<!--
  #%L
  ff4j-core
  %%
  Copyright (C) 2013 Ff4J
  %%
  Licensed under the Apache License, Version 2.0 (the "License");
  you may not use this file except in compliance with the License.
  You may obtain a copy of the License at
  
       http://www.apache.org/licenses/LICENSE-2.0
  
  Unless required by applicable law or agreed to in writing, software
  distributed under the License is distributed on an "AS IS" BASIS,
  WITHOUT WARRANTIES OR CONDITIONS OF ANY KIND, either express or implied.
  See the License for the specific language governing permissions and
  limitations under the License.
  #L%
  -->

<features xmlns="http://www.ff4j.org/schema/ff4j" 
     xmlns:xsi="http://www.w3.org/2001/XMLSchema-instance"
	 xsi:schemaLocation="http://www.ff4j.org/schema/ff4j ../../main/resources/ff4j-1.2.0.xsd">


	<feature-group name="group1">
	</feature-group>
	
	<feature-group name="group2">
		<feature uid="f1" enable="true" description="abc" />
		<feature uid="f2" enable="false" description="def" />
		<feature uid="f3" enable="true" description="ghj" />
	</feature-group>

	<feature-group name="group3">
		<feature uid="f0" enable="true" description="description">
			<flipstrategy class="org.ff4j.strategy.el.ExpressionFlipStrategy">
				<param name="expression"><![CDATA[A | B]]></param>
			</flipstrategy>
			<security>
				<role name="X" />
				<role name="Y" />
			</security>
		</feature>
	</feature-group>

	<feature uid="f4" enable="true" description="description">
		<flipstrategy class="org.ff4j.strategy.time.ReleaseDateFlipStrategy">
			<param name="releaseDate" value="2013-07-14-14:00" />
		</flipstrategy>
	</feature>
	
	<feature uid="f6" enable="true" description="description">
		<flipstrategy class="org.ff4j.strategy.time.ReleaseDateFlipStrategy">
			<param name="releaseDate">2013-07-14-14:00</param>
		</flipstrategy>
	</feature>
	
	<feature uid="f5" enable="true" >
		<security>
			<role name="X" />
			<role name="Y" />
		</security>
	</feature>

</features>